,adult,backdrop_path,genre_ids,id,original_language,overview,popularity,poster_path,release_date,title,video,vote_average,vote_count
34,False,/xs6awEGjnH3e36YSAromfYu3PBQ.jpg,"[35, 18, 14]",40096,pt,,7.705,/imcOp1kJsCsAFCoOtY5OnPrFbAf.jpg,2000-09-15,어 독스 윌,False,8.4,930
35,False,/l5K9elugftlcyIHHm4nylvsn26X.jpg,"[18, 10751]",255709,ko,"어느 비 오는 아침, 학교를 가던 9살 소녀 소원은 술에 취한 아저씨에게 끌려가 믿고 싶지 않은 사고를 당한다. 이 일로 몸과 마음에 지울 수 없는 상처를 받은 소원이네 가족. 하지만 절망 끝에서 희망을 찾아 나서는데...",28.141,/PZlNvDwKwHeHUsXnd6SEDXWZNn.jpg,2013-10-02,소원,False,8.4,453
36,False,/5p3aTxtUtZHCHwYsuycutmxIhND.jpg,"[18, 80]",598,pt,"빈민가가 막 형성되기 시작한 1960년대, 마을을 지나가는 배달 트럭을 털면서 가족을 부양하는 텐더 삼총사가 주름잡던 그 시기에는 엄연한 룰이 존재했다. 돈은 훔치되 살인은 삼가는 것이다. 이들은 엉뚱한 용의자를 사살하고도 지갑을 챙기는 악질 경찰에 비하면 약자에 불과했다. 텐더 트리오 시대에 종지부를 찍은 제빼게노는 큰 돈을 만지기 위해서는 마약을 다뤄야 함을 알게 된다. 단짝친구 베네는 악랄하기만 할 뿐 주변을 다독일 줄 모르던 제빼게노를 보좌하며 또 다른 룰을 만들어내지만, 위태로운 평화의 유효기간은 그리 길지 않다.",33.834,/iKXrQB16sxeXoc6GlnYjeeZKsOW.jpg,2002-02-05,시티 오브 갓,False,8.4,6092
37,False,/9LuL3pwJiwIWSckeCbOX8G12F4X.jpg,"[28, 12, 16, 878]",324857,en,"평범한 10대 마일스 모랄레스는 우연히 방사능 거미에 물려 스파이더맨 능력을 가지게 된다. 혼란스러워하던 마일스는 악당과 싸우고 있는 피터 파커를 마주치게 되고 피터 파커는 마일스가 자신과 같은 능력을 가지고 있음을 직감한다. 여러 개의 평행세계가 존재한다는 것을 알게 된 마일스와 피터 파커는 이후 스파이더우먼 스파이더 그웬, 스파이더맨 누아르, 스파이더햄 등 평행세계 속 공존하는 모든 스파이더맨들을 만나게 되는데... 하나의 유니버스에서 만나 팀을 결성한 스파이더맨들은 과연 세계를 구할 수 있을까?",83.819,/vnWgIIEWAvWKOI65tm6h6VRbyY8.jpg,2018-12-06,스파이더맨: 뉴 유니버스,False,8.4,11952
38,False,/qknxyRgP6UTmwJ4B9tDAmzHMq7u.jpg,"[10749, 16, 14]",92321,ja,미도리카와 유키의 동명만화를 원작으로 한 작품으로 숲에서 길을 잃은 주인공이 요술로 사람의 눈에 보이는 힘이 있는 요괴와 만난 이야기를 그리고 있다.,0.6,/ijAOOOrcLViYPkXIauhRhCj2ySf.jpg,2011-09-17,반딧불이의 숲으로,False,8.4,856
39,False,/q5HZvtyqG8Vz39Ee9uTQbLeEml.jpg,"[16, 18]",378064,ja,"따분한 게 질색인 아이, 이시다 쇼야.  간디가 어떤 사람인지, 인류의 진화과정이라든지, 알게뭐람.  어느 날 쇼야의 따분함을 앗아갈 전학생이 나타났다. 니시미야 쇼코. 그 아이는 귀가 들리지 않는다고 한다.  쇼야의 짓궂은 장난에도 늘, 생글생글 웃고만 있다. 짜증난다.  그의 괴롭힘에 쇼코는 결국 전학을 갔고, 이시다 쇼야는 외톨이가 되었다.  6년 후, 더 이상 이렇게 살아봐야 의미가 없음을 느낀 쇼야는 마지막으로 쇼코를 찾아간다.  처음으로 전해진 두 사람의 목소리. 두 사람의 만남이 교실을, 학교를,  그리고 쇼야의 인생, 쇼코의 인생을 바꾸기 시작한다.",80.844,/emNuB1GNGjJqZiK9uVJNiUPbgsx.jpg,2016-09-17,목소리의 형태,False,8.4,3169
