,adult,backdrop_path,genre_ids,id,original_language,overview,popularity,poster_path,release_date,title,video,vote_average,vote_count
0,False,/rl7Jw8PjhSIjArOlDNv0JQPL1ZV.jpg,"[10749, 18]",851644,ko,"보라의 둘도 없는 친구 연두는 심장 수술을 위해 미국에 가면서 자신이 좋아하는 남자 백현진에 대한 모든 정보를 수집해 달라고 보라에게 부탁한다. 보라는 백현진의 가장 친한 친구 풍운호와 먼저 친해지기로 한다. 하지만 보라의 서투른 계획은 예상치 못한 방향으로 전개된다. 새로운 세기가 오기 1년 전인 1999년, 17세가 된 보라는 첫사랑의 열병에 빠진다.",348.878,/xM9Jt2sA6QcvLuHKM0RI3BMtFc5.jpg,2022-10-06,20세기 소녀,False,8.8,242
1,False,/rSPw7tgCH9c6NqICZef4kZjFOQ5.jpg,"[18, 80]",238,en,"시실리에서 이민온 뒤, 정치권까지 영향력을 미치는 거물로 자리잡은 돈 꼴레오네는 갖가지 고민을 호소하는 사람들의 문제를 해결해주며 대부라 불리운다. 한편 솔로소라는 인물은 꼴레오네가와 라이벌인 탓타리아 패밀리와 손잡고 새로운 마약 사업을 제안한다. 돈 꼴레오네가 마약 사업에 참여하지 않기로 하자, 돈 꼴레오네를 저격해 그는 중상을 입고 사경을 헤매게 된다. 그 뒤, 돈 꼴레오네의 아들 소니는 조직력을 총 동원해 다른 패밀리들과 피를 부르는 전쟁을 시작하는데... 가족의 사업과 상관없이 대학에 진학한 뒤 인텔리로 지내왔던 막내 아들 마이클은 아버지가 총격을 당한 뒤, 아버지를 구하기 위해 위험천만한 협상 자리에 나선다.",90.096,/cOwVs8eYA4G9ZQs7hIRSoiZr46Q.jpg,1972-03-14,대부,False,8.7,16912
2,False,/kXfqcdQKsToO0OUXHcrrNCHDBzO.jpg,"[18, 80]",278,en,"촉망받는 은행 간부 앤디 듀프레인은 아내와 그녀의 정부를 살해했다는 누명을 쓴다. 주변의 증언과 살해 현장의 그럴듯한 증거들로 그는 종신형을 선고받고 악질범들만 수용한다는 지옥같은 교도소 쇼생크로 향한다. 인간 말종 쓰레기들만 모인 그곳에서 그는 이루 말할 수 없는 억압과 짐승보다 못한 취급을 당한다. 그러던 어느 날, 간수의 세금을 면제받게 해 준 덕분에 그는 일약 교도소의 비공식 회계사로 일하게 된다. 그 와중에 교도소 소장은 죄수들을 이리저리 부리면서 검은 돈을 긁어 모으고 앤디는 이 돈을 세탁하여 불려주면서 그의 돈을 관리하는데...",68.371,/oAt6OtpwYCdJI76AVtVKW1eorYx.jpg,1994-09-23,쇼생크 탈출,False,8.7,22656
3,False,/poec6RqOKY9iSiIUmfyfPfiLtvB.jpg,"[18, 80]",240,en,"아버지의 장례식 도중에 맏아들 파올로가 총에 맞아 죽고, 비토(로버트 드니로)는 겨우 도망쳐 미국으로 건너온다. 대부로 성장한 후 비토는 다시 치치오를 찾아 복수를 한다. 새롭게 등장한 젊은 대부 마이클(알 파치노)은 본거지를 라스베가스로 옮기고 가족의 사업을 가능한 합법적인 것으로 바꾸려고 애쓴다. 그런 과중 중에 자신을 제거하려는 음모를 알게되고 그는 냉혹하고 신속하게 반대파들을 제거, 조직을 더욱 확대해 나간다. 이를 위해 마이클은 배신한 형마저 죽이고, 일 때문에 아내와 헤어지는 등 인간적으로는 계속 외로워져 가는데...",57.636,/cj9UsJEN5bNf6ZoF1BbKjKN81hc.jpg,1974-12-20,대부 2,False,8.6,10252
4,False,/aVFx1VtlOxR3v0ADEatalXOvwbu.jpg,"[16, 14, 28]",620249,zh,"숲속의 집을 잃고 홀로 떠돌던 검은 고양이 요정 ‘소흑’은 도시 뒷골목에서 미스터리한 능력의 요정 ‘풍식’을 만나 위기를 모면한다. ‘풍식’의 무리와 버려진 섬에서 행복한 시간을 보내는 ‘소흑’. 그러던 중 최강 능력의 집행자 ‘무한’이 ‘풍식’을 쫓아 섬에 오자 ‘풍식’ 일행은 달아나고, ‘소흑’만 남게 된다.  홀로 남은 ‘소흑’을 요정들의 회관으로 데려가려는 ‘무한’과 ‘무한’을 무서운 인간이라 여겨 도망치려는 ‘소흑’. 둘은 여정 속에서 점점 마음을 열게 되고, ‘무한’은 ‘소흑’에게 특별한 능력이 있음을 알게 된다.",18.892,/nDieZR47cirx44UZxKQsCbRGYqW.jpg,2019-08-27,나소흑전기: 첫만남편,False,8.6,208
5,False,/zb6fM1CX41D9rF9hdgclu0peUmy.jpg,"[18, 36, 10752]",424,en,"2차 세계대전 당시 독일군이 점령한 폴란드. 시류에 맞춰 자신의 성공을 추구하는 기회주의자 쉰들러는 유태인이 경영하는 그릇 공장을 인수한다. 그는 공장을 인수하기 위해 나찌 당원이 되고 독일군에게 뇌물을 바치는 등 갖은 방법을 동원한다. 그러나 냉혹한 기회주의자였던 쉰들러는 유태인 회계사인 스턴과 친분을 맺으면서 냉혹한 유태인 학살에 대한 양심의 소리를 듣기 시작한다. 마침내 그는 강제 수용소로 끌려가 죽음을 맞게될 유태인들을 구해내기로 결심하고, 독일군 장교에게 빼내는 사람 숫자대로 뇌물을 주는 방법으로 유태인들을 구해내려는 계획을 세우는데...",45.178,/oyyUcGwLX7LTFS1pQbLrQpyzIyt.jpg,1993-12-15,쉰들러 리스트,False,8.6,13446
6,False,/vI3aUGTuRRdM7J78KIdW98LdxE5.jpg,"[35, 18, 10749]",19404,hi,영국에서 유학중인 라즈(샤룩 칸)와 인도 처녀 심란(까졸).  심란은 부모님이 정해주신 약혼자가 있는데 약혼을 앞두고 친구들과 유럽 여행을 떠나게 된다.  여행 중 우연히 만남 샤룩과 까졸. 두 남녀의 연속된 우연과 좌충우돌 사랑 만들기.  그렇게 사랑하게 된 그들이지만 까졸은 약혼자가 있는 몸. 인도로 돌아가게 된다.  샤룩 또한 그녀를 못 잊어 인도로 뒤 따라 들어가지만 엄격한 까졸의 부모를 설득하기가 힘이 든다. 도망가자는 까졸의 제안을 거부하고 샤룩은 끝내 그녀의 부모님의 허락을 얻어 내기 위해 고군분투한다.,27.112,/2CAL2433ZeIihfX1Hb2139CX0pW.jpg,1995-10-19,용감한 자가 신부를 데려가리,False,8.6,3943
7,False,/bxSBOAD8AuMHYMdW3jso9npAkgt.jpg,"[10751, 18]",667257,es,"폭력적인 남편의 사망 후, 마틸데는 여전히 트라우마와 외로움 그리고 유령같이 그녀의 주변을 맴도는 남편의 흔적에 시달린다. 이웃집 소년 미겔과 가까워진 마틸데는 미겔의 마약 판매에 가담하면서, 이전까지 경험하지 못했던 새로운 삶에 눈을 뜨기 시작한다. 나이 차에도 불구하고 두 사람이 나누는 평범하지 않은 우정은 서로의 상처를 보듬고 치유해 준다. 삶의 막다른 골목에서, 불가능해 보였던 희망을 향해 나아가는 마틸데와 미겔의 용기 어린 선택이 감동으로 다가온다.",10.022,/eaf7GQj0ieOwm08rrvjJQNbN0kN.jpg,2021-06-17,불가능한 것들,False,8.5,276
8,False,/Ab8mkHmkYADjU7wQiOkia9BzGvS.jpg,"[16, 10751, 14]",129,ja,평범한 열 살 짜리 소녀 치히로 식구는 이사 가던 중 길을 잘못 들어 낡은 터널을 지나가게 된다. 터널 저편엔 폐허가 된 놀이공원이 있었고 그곳엔 이상한 기운이 흘렀다. 인기척 하나 없는 이 마을의 낯선 분위기에 불길한 기운을 느낀 치히로는 부모님에게 돌아가자고 조르지만 부모님은 호기심에 들떠 마을 곳곳을 돌아다니기 시작한다. 어느 음식점에 도착한 치히로의 부모님은 그 곳에 차려진 음식들을 보고 즐거워하며 허겁지겁 먹어대다가 돼지로 변해버린다. 겁에 질려 당황하는 치히로에게 낯선 소년 하쿠가 나타나 빨리 이곳을 나가라고 소리치는데...,86.61,/u1L4qxIu5sC2P082uMHYt7Ifvnj.jpg,2001-07-20,센과 치히로의 행방불명,False,8.5,13554
9,False,/qqHQsStV6exghCM7zbObuYBiYxw.jpg,[18],389,en,"뉴욕시의 법정에 아버지를 칼로 찌른 한 소년의 살인혐의를 두고, 12인의 배심원들은 만장일치 합의를 통해 소년의 유무죄 여부를 가려줄 것을 요구받는다. 판사는 유죄일 경우 이 소년은 사형이 불가피하다는 것을 이들에게 미리 일러둔다.  배심원 방에 모인 이들은 투표를 통해 유무죄 여부를 가리기로 한다. 사람들이 전부 소년이 유죄로 판단하는 가운데, 오직 한 배심원만이 소년이 무죄라고 주장하는데...",28.778,/ppd84D2i9W8jXmsyInGyihiSyqz.jpg,1957-04-10,12명의 성난 사람들,False,8.5,6791
10,False,/3RMLbSEXOn1CzLoNT7xFeLfdxhq.jpg,"[10749, 16]",372754,ja,"밴드 활동을 하며 여자에게도 인기가 많은 쿠사카베 히카루.  고교 입시에서 만점을 받은 인재 사죠 리히토. 도무지 접점이 없어 보이는 두 남학생은 합창 대회 연습을 계기로 친해진다. 음을 느끼고 목소리에 귀를 기울이고 화음을 만들어가며 둘의 마음은 공명하기 시작하는데… 느긋하게 고조되다 뜻밖의 순간에 터져버리는 사랑의 감정. 순수하고 솔직한 쿠사카베 히카루와 그를 밀어내면서도 조금씩 마음을 열어가는 사죠 리히토.  청춘의 풋풋함 속에서 고민하고, 망설이며 앞으로 나아가고자 하는 그들이 깨달은 마음이란…",15.539,/jNJ9shLhjRavjrCGRnoTmYB18d2.jpg,2016-02-20,동급생,False,8.5,260
11,False,/mMtUybQ6hL24FXo0F3Z4j2KG7kZ.jpg,"[10749, 16, 18]",372058,ja,"시골에 사는 소녀 미츠하(가미시라이시 모네)는 어느 날 잠에서 깬 후 자신의 몸이 남자로 바뀐 걸 알게 된다. 같은 시간, 도쿄에 사는 소년 타키(가미키 류노스케) 역시 이 기이한 상황을 겪고 있다. 낯선 가족, 낯선 친구들, 낯선 풍경들... 서로에게 이어진 끈을 알게 된 둘은 둘만의 규칙을 정하고 점차 상황을 받아들이기 시작한다. 서로에게 남긴 메모를 확인하며  점점 친구가 되어가는 타키와 미츠하. 언제부턴가 더 이상 몸이 바뀌지 않자  자신들이 특별하게 이어져있었음을 깨달은  타키는 미츠하를 만나러 가는데...",126.455,/wx1Dxr4UyvN18SyC5GsVWWWtYja.jpg,2016-08-26,너의 이름은,False,8.5,9224
12,False,/TU9NIjwzjoKPwQHoHshkFcQUCG.jpg,"[35, 53, 18]",496243,ko,"전원 백수로 살 길 막막하지만 사이는 좋은 기택 가족. 장남 기우에게 명문대생 친구가 연결시켜 준 고액 과외 자리는 모처럼 싹튼 고정수입의 희망이다. 온 가족의 도움과 기대 속에 박 사장 집으로 향하는 기우. 글로벌 IT기업의 CEO인 박 사장의 저택에 도착하자 젊고 아름다운 사모님 연교와 가정부 문광이 기우를 맞이한다. 큰 문제 없이 박 사장의 딸 다혜의 과외를 시작한 기우. 그러나 이렇게 시작된 두 가족의 만남 뒤로, 걷잡을 수 없는 사건이 기다리고  있는데.....",66.783,/jjHccoFjbqlfr4VGLVLT7yek0Xn.jpg,2019-05-30,기생충,False,8.5,14706
13,False,/l6hQWH9eDksNJNiXWYRkWqikOdu.jpg,"[14, 18, 80]",497,en,"미국 루이지애나의 콜드 마운틴 교도소. 폴은 사형수 감방의 간수장으로 일하고 있다. 그의 일은 사형수들을 감독하고, 그린 마일이라 불리는 초록색 복도를 거쳐 그들을 사형 집행장까지 안내하는 것. 폴은 그들이 죽음을 맞이하는 순간까지 평화롭게 지낼 수 있도록 최선을 다한다. 어느 날 존 커피라는 사형수가 이송되어 온다. 그는 쌍둥이 여자아이를 살해한 흉악범. 하지만 순진한 눈망울에 겁을 잔뜩 집어먹은 그의 모습에 폴은 당혹감을 느낀다. 게다가 그는 초자연적 능력으로 폴의 지병을 깨끗하게 치료해주기까지 한다. 존을 전기 의자로 데려가야 할 날이 다가오면서 폴은 그가 무죄라는 확신을 갖게 되는데...",78.69,/yuSpRhrTIJa5JN8oESrfD2bndp1.jpg,1999-12-10,그린 마일,False,8.5,14624
14,False,/nMKdUUepR0i5zn0y1T4CsSB5chy.jpg,"[18, 28, 80, 53]",155,en,"범죄와 부정부패를 제거하여 고담시를 지키려는 배트맨. 그는 짐 고든 형사와 패기 넘치는 고담시 지방 검사 하비 덴트와 함께 도시를 범죄 조직으로부터 영원히 구원하고자 한다. 세 명의 의기투합으로 위기에 처한 악당들이 모인 자리에 보라색 양복을 입고 얼굴에 짙게 화장을 한 괴이한 존재가 나타나 배트맨을 죽이자는 사상 초유의 제안을 한다. 그는 바로 어떠한 룰도, 목적도 없는 사상 최악의 악당 미치광이 살인광대 조커. 배트맨을 죽이고 고담시를 끝장내버리기 위한 조커의 광기 어린 행각에 도시는 혼란에 빠지는데...",79.96,/f6dNinWX8rBM79JXKcShkfSh2oA.jpg,2008-07-14,다크 나이트,False,8.5,28581
15,False,/jtAI6OJIWLWiRItNSZoWjrsUtmi.jpg,[10749],724089,en,,12.794,/8Rxutea68d940kg44Box5gFmKcF.jpg,2020-07-31,가브리엘의 지옥 파트 2,False,8.5,1442
16,False,/w2uGvCpMtvRqZg6waC1hvLyZoJa.jpg,[10749],696374,en,,11.952,/oyG9TL7FcRP4EZ9Vid6uKzwdndz.jpg,2020-05-29,가브리엘의 지옥,False,8.5,2297
17,False,/aQ7444JX7gefPhGJTlvilj3zG2S.jpg,[10402],553512,ko,"19개 도시, 40회의 공연, 55만석 날개를 펼친 소년들의 역사. 성공적인 월드 투어로 마무리된 ‘2017 방탄소년단 라이브 트릴로지 에피소드3 윙스 투어(2017 BTS LIVE TRILOGY EPOSODE III THE WINGS TOUR)’를 가장 가까이에서 담아낸 방탄소년단의 첫 번째 영화! 지금, 우리  함께 빛나는 청춘의 순간이 스크린에 펼쳐진다.",16.436,/pJKy1yvnKh8UjcuYeG3Rt35xHFA.jpg,2018-11-15,번 더 스테이지: 더 무비,False,8.5,371
18,False,/suaEOtk1N1sgg2MTM7oZd2cfVp3.jpg,"[53, 80]",680,en,"펌프킨와 허니 버니가 레스토랑에서 강도 행각을 벌이기 시작한다. 빈센트와 그 동료 쥴스는 두목의 금가방을 찾기 위해 다른 건달이 사는 아파트를 찾아간다. 마르셀러스는 부치에게 돈을 주며 상대 선수에게 져 주라고 하지만 부치는 상대 선수를 때려 눕히고 도망치다, 어릴 때 아버지에게 물려받은 시계를 찾기 위해 아파트로 향한다. 아무런 상관 없이 보이는 이 사건들이 서로 얽히고 섥히면서 예상치 못한 인과관계가 만들어지는데...",73.56,/6lXRHGoEbnnBUKsuqpL9JxD4DzT.jpg,1994-09-10,펄프 픽션,False,8.5,24059
19,False,/x4biAVdPVCghBlsVIzB6NmbghIz.jpg,[37],429,it,"미국의 남북전쟁이 한창인 때, 블론디는 멕시코인 총잡이 투코와 함께 동업 중이다. 블론디는 현상범 투코를 잡아 현상금을 받고, 투코가 교수형을 당하는 순간 구해주는 역할. 한편 세텐자라 불리우는 범죄자는 엄청나 돈이 묻힌 비밀장소를 추적 중이다. 그런데, 투코와 실랑이를 벌이던 블론디는 돈이 묻힌 장소를 죽어가는 사람에게 듣게 되고, 결국 둘은 돈을 찾아 나서는데...",52.841,/sOTQkPoEZd7ImsZBuXfu4BqZ6JS.jpg,1966-12-23,석양의 무법자,False,8.5,6973
20,False,/67HggiWaP9ZLv5sPYmyRV37yAJM.jpg,"[35, 18, 10749]",13,en,"불편한 다리, 남들보다 조금 떨어지는 지능을 가진 포레스트 검프는 헌신적인 어머니의 보살핌과 첫사랑 제니와의 만남으로 편견과 괴롭힘 속에서도 따뜻한 마음을 지니고 성장한다. 또래들의 괴롭힘을 피해 도망치던 포레스트는 누구보다 빠르게 달릴 수 있는 자신의 재능을 깨닫는다. 그의 재능을 알아 본 대학에서 그를 미식축구 선수로 발탁하고, 졸업 후에도 뛰어난 신체능력으로 군에 들어가 무공훈장을 수여받는 등 탄탄한 인생 가도에 오르게 된 포레스트. 하지만 어머니가 병에 걸려 죽음을 맞이하고, 첫사랑 제니 역시 그의 곁을 떠나가며 다시 한 번 인생의 전환점을 맞이하게 되는데...",59.28,/xdJxoq0dtkchOkUz5UVKuxn7a2V.jpg,1994-06-23,포레스트 검프,False,8.5,23603
21,False,/lXhgCODAbBXL5buk9yEmTpOoOgR.jpg,"[12, 14, 28]",122,en,"사우론이 인간들의 마지막 요새인 곤도르를 향해 야욕을 드러내고 있는 한편, 아라곤은 쇠락해가고 있는 곤도르의 재건을 위해 왕위 계승을 신중하게 결정지어야만 하는 상황. 이제 중간대륙의 미래는 그의 어깨에 달려있는 것. 사우론이 이끄는 어둠의 군대와의 마지막 전투를 위해 간달프는 곤도르에 흩어져 있던 병사들을 모으고, 로한의 왕 세오덴에게 도움을 받기도 하지만 사우론의 군대에 비하면 열세를 면치 못한다. 그러나 그들은 중간대륙을 사우론의 야욕으로부터 지키려는 사명감과, 마지막 반지 운반자에게 임무를 끝낼 기회를 주기 위해 어둠의 군대를 향해 돌진하게 되는데...",112.816,/tAXXuEAKLk2mOEIJzwajJQEnVZu.jpg,2003-12-01,반지의 제왕: 왕의 귀환,False,8.5,20535
22,False,/sw7mordbZxgITU877yTpZCud90M.jpg,"[18, 80]",769,en,"아일랜드계 이탈리아인 헨리 힐와 토미는 13살에 마피아에 입문해 지미와 함께 트럭이나 공항 화물을 훔치는 일을 한다. 결혼 후에도 마피아 생활을 계속하는 헨리는 이제 조직에서도 안정된 위치와 경제적 여유를 갖는다.  어느 날 헨리와 지미는 공항터미널 사건을 모의해 현금 6백만 달러라는 엄청한 돈을 훔친다. 이 사건을 은폐하기 위해 혈안이 된 지미는 모의에 참여했던 사람들을 죽이고, 토미는 마피아 조직에 가담했다가 살해당한다. 엎친데 덮친격으로 헨리마저 마약거래로 경찰서에 잡혀 들어가는데...",69.807,/zF9hSBS1t7PVFLo01GrJ3OjGi67.jpg,1990-09-12,좋은 친구들,False,8.5,10666
23,False,/fQq1FWp1rC89xDrRMuyFJdFUdMd.jpg,"[10749, 35]",761053,en,,53.292,/fYtHxTxlhzD4QWfEbrC1rypysSD.jpg,2020-11-19,Gabriel's Inferno: Part III,False,8.5,993
24,False,/zoVeIgKzGJzpdG6Gwnr7iOYfIMU.jpg,"[18, 10749]",11216,it,"어린 시절 영화가 세상의 전부였던 소년 토토는 학교 수업을 마치면 마을 광장에 있는 낡은 시네마 천국이라는 극장으로 달려가 영사 기사 알프레도와 친구로 지내며 어깨너머로 영사기술을 배운다. 어느 날 관객들을 위해 광장에서 야외 상영을 해주던 알프레도가 그만 화재 사고로 실명하게 되고, 토토가 그의 뒤를 이어 시네마 천국의 영상기사로 일하게 된다. 실명한 후에도 토토의 친구이자 아버지로 든든한 정신적 지주가 되어준 알프레도는 청년이 된 토토가 사랑하는 여자 엘레나의 부모님의 반대로 좌절하자 넓은 세상으로 나가서 더 많은 것을 배우라며 권유하는데...",35.694,/r782z4H7GzkyNaf3hAtBB4pVkOj.jpg,1988-11-17,시네마 천국,False,8.5,3515
25,False,/gavyCu1UaTaTNPsVaGXT6pe5u24.jpg,"[35, 18]",637,it,"로마에 갓 상경한 시골 총각 귀도는 운명처럼 만난 여인 도라에게 첫눈에 반한다. 넘치는 재치와 유머로 약혼자가 있던 그녀를 사로잡은 귀도는 가정을 꾸리며 분신과도 같은 아들 조수아를 얻는다. 조수아의 다섯 살 생일, 갑작스레 들이닥친 군인들은 귀도와 조수아를 수용소 행 기차에 실어버리고, 소식을 들은 도라 역시 기차에 따라 오른다. 귀도는 아들을 달래기 위해 무자비한 수용소 생활을 단체게임이라 속이고 1,000점을 따는 우승자에게는 진짜 탱크가 주어진다고 말한다. 하루하루가 지나 어느덧 전쟁이 끝났다는 말을 들은 귀도는 조수아를 창고에 숨겨둔 채 아내를 찾아 나서는데...",44.246,/yjOqQsQHdsEZfAosZERqHiwjaty.jpg,1997-12-20,인생은 아름다워,False,8.5,11450
26,False,/qvZ91FwMq6O47VViAr8vZNQz3WI.jpg,"[28, 18]",346,ja,"일본의 전국시대. 주민들은 황폐한 땅에서 어렵게 수확한 식량으로 한해 한해를 넘기는 빈촌에 살고 있다. 이 빈촌엔 보리 수확이 끝날 무렵이면 어김없이 산적들이 찾아와 모든 식량을 모조리 약탈해 간다. 싸워도 애원해도 소용이 없었다. 가만히 있을 수만은 없던 촌장의 결단으로 사무라이들을 모집하는데, 이들은 풍부한 전쟁 경험을 가진 시마다 칸베에를 포함한 7명이었다. 시마다의 지휘하에 마을은 방위태세를 갖추고 전투훈련도 시작한다. 이윽고 산적들의 공격이 시작되어 치열한 사투가 벌어진다.",24.338,/6Y8Q5t79ybiDA7XubUTneqZhjA3.jpg,1954-04-26,7인의 사무라이,False,8.5,2849
27,False,/nC3IjYhUgZWgfKfFX0ygMigFwgc.jpg,"[28, 18, 36]",14537,ja,"사소한 잘못으로 상부로부터 할복 명령을 하달받은 사무라이가 그것에 저항하는 이야기. 인습과 전통에 대해 순응하는 일본 사회에 저항하는 메세지를 담은 작품.",20.863,/rnYgzVuPaeKnZ85XJlukxmlFcrN.jpg,1962-09-15,하라키리,False,8.4,694
28,False,/uif5fUshJrXyyDzfpzp1DLw3N0S.jpg,"[27, 18, 53]",539,en,"마리온 크레인은 그녀의 애인 샘과 결혼하길 원하지만 샘은 빚을 갚을 때까지 기다리라고 말한다. 그래서 그녀는 자신이 다니고 있는 회사 사장이 은행에 입금하라고 맡긴 돈을 들고 도망친다. 도주 첫날 밤 묵게 된 도로변의 낡은 모텔 주인인 노만 베이츠는 그녀에게 친절하게 대해주며 자신은 모텔 바로 뒤쪽 저택에서 몸이 불편한 어머니와 함께 살고 있다고 말한다. 잠자리에 들기 전 마리온이 샤워를 하는 도중, 난데없이 검은 형상이 욕실에 나타나고 마리온은 실종된다. 마리온을 찾기 위해 그녀의 언니 릴라와 샘, 그리고 보험회사 측에서 고용한 탐정 등 세 사람이 추적에 나서는데...",41.425,/vC3P8hH4r3I3fHiRFa1kj6yzeaN.jpg,1960-06-22,싸이코,False,8.4,8565
29,False,/uPYa165sraN2c8gZBM9C47g3JoU.jpg,"[18, 80]",311,en,"1921년, 좀도둑질을 일삼던 누들스는 친구들과 함께 밀수품 운반 일을 하며 돈을 벌어들인다. 누들스 무리에 위협을 느낀 벅시는 누들스의 친구를 죽이고, 분노한 누들스는 벅시를 살해한 후 감옥에 들어가게 된다. 1932년, 출소한 누들스는 어린 시절 첫사랑 데보라와 밀주 사업으로 크게 성공한 맥스를 다시 만나지만, 금주법 철폐로 밀주 사업도 위기를 맞는다. 맥스는 누들스에게 연방준비은행을 털 것을 제안하지만 누들스는 거절한다. 1968년, 베일리 재단 파티에 초대 받은 누들스는 재단 창립 기념 사진 속에서 데보라를 발견하고 그녀를 찾아가는데...",28.636,/xbuc6sjIIopkA1Ep24rR6yCw0DK.jpg,1984-05-23,원스 어폰 어 타임 인 아메리카,False,8.4,4420
30,False,/gwj4R8Uy1GwejKqfofREKI9Jh7L.jpg,"[16, 18, 10752]",12477,ja,"2차 세계대전, 일본의 한 마을에 폭격기로 인한 대공습이 일어난다. 마을이 화염으로 휩싸이자, 14살인 세이타는 부모님과 따로 만나기로 약속한 채 4살짜리 여동생 세츠코를 업고 피신한다. 결국 집과 어머니를 잃고 먼 친척아주머니의 집으로 향하는 세이타와 세츠코. 힘들고 어려운 환경에서도 오빠 세이타는 천진하고 착한 여동생 세츠코를 보면서 희망과 용기를 잃지 않는다. 하지만 시간이 지날수록 친척아주머니의 남매에 대한 냉대는 더욱 심해지고, 세이타는 어머니가 남겨주었던 마지막 여비를 챙겨 세츠코와 함께 산 속에 있는 방공호로 거처를 옮긴다. 두 남매는 산 속 동굴에서 반딧불이를 잡아 불을 밝히고, 물고기와 개구리를 잡아먹으며 살아가는데...",0.6,/uN0x0G4uuRjFJIFN57iYihBV2Qh.jpg,1988-04-16,반딧불이의 묘,False,8.4,4374
31,False,/qUq3QTr2KLvGIcN0GaaaYx9bbyH.jpg,[18],510,en,"많은 죄를 짓고 수감중이던 맥머피는 교도소에서 정신 병원으로 후송되는데, 감옥보다는 자유로울 것으로 생각했지만 전혀 그렇지 않다는 것을 깨닫는다. 정신 병원의 여러 환자들과 생활하면서 맥머피는 그들이 겉으로는 전혀 문제가 없어 보이지만 보이지 않는 병원내의 압력에 의해 짓눌려 사는 죽은 인간들임을 간파한다. 그리고 그러한 압력의 주범이 간호사 레취드임을 알게 된다. 맥머피는 환자들을 끌고 병원을 빠져나가 낚시를 다녀오거나 파티를 여는 등 의도적인 반항을 시도하다 결국 탈출을 결심하게 되는데...",27.672,/eH5F8tz5a0EHed7egeKf4XoNvLD.jpg,1975-11-19,뻐꾸기 둥지 위로 날아간 새,False,8.4,8955
32,False,/c6OLXfKAk5BKeR6broC8pYiCquX.jpg,"[18, 53, 35]",550,en,"자동차 회사의 리콜 심사관으로 일하는 주인공(에드워드 노튼)은 일상의 무료함과 공허함 속에서 늘 새로운 탈출을 꿈꾼다. 그는 비행기에서 자신을 비누 제조업자라고 소개하는 타일러 더든(브래드 피트)을 만난다. 집에 돌아온 주인공은 아파트가 누군가에 의해 폭파되었음을 발견하고, 타일러에게 도움을 청해 함께 생활하게 된다. 어느 날 밤 타일러는 주인공에게 자신을 때려달라고 부탁한다. 사람은 싸워봐야 진정한 자신을 알 수 있다는 것이다. 결국 이들은 매주 토요일 밤 술집 지하에서 맨주먹으로 격투를 벌이는 파이트 클럽을 결성하기에 이르는데...",149.164,/eKZ07Ted7VHxQjbuZrRBFOamcKJ.jpg,1999-10-15,파이트 클럽,False,8.4,25177
33,False,/uBZQOYZLIU9dBmd62fdzBAoropu.jpg,"[28, 12, 16, 18]",704264,en,,27.599,/9NBBkdxH0TjQEBSN2AzeE1sgsF9.jpg,2019-11-21,Primal: Tales of Savagery,False,8.4,245
